{
  "$schema": "https://json-schema.org/draft/2020-12/schema",
  "title": "Network Preset v1",
  "type": "object",
  "properties": {
    "schemaVersion": {
      "const": "1.0"
    },
    "id": {
      "type": "string",
      "minLength": 1,
      "maxLength": 80,
      "pattern": "^[a-z][a-z0-9_-]*$"
    },
    "label": {
      "type": "string",
      "minLength": 1,
      "maxLength": 120
    },
    "description": {
      "type": "string",
      "minLength": 1,
      "maxLength": 500
    },
    "network": {
      "type": "object",
      "properties": {
        "subnets": {
          "type": "array",
          "items": {
            "type": "object",
            "properties": {
              "subnetId": {
                "type": "string",
                "minLength": 1,
                "maxLength": 80,
                "pattern": "^[a-z][a-z0-9_-]*$"
              },
              "label": {
                "type": "string",
                "minLength": 1,
                "maxLength": 120
              },
              "cidr": {
                "type": "string",
                "minLength": 3,
                "maxLength": 80
              },
              "trustBoundaryId": {
                "type": "string",
                "minLength": 1,
                "maxLength": 80,
                "pattern": "^[a-z][a-z0-9_-]*$"
              }
            },
            "required": [
              "subnetId",
              "label",
              "cidr",
              "trustBoundaryId"
            ],
            "additionalProperties": false
          },
          "minItems": 1,
          "maxItems": 32
        },
        "nodes": {
          "type": "array",
          "items": {
            "type": "object",
            "properties": {
              "nodeId": {
                "type": "string",
                "minLength": 1,
                "maxLength": 80,
                "pattern": "^[a-z][a-z0-9_-]*$"
              },
              "label": {
                "type": "string",
                "minLength": 1,
                "maxLength": 120
              },
              "nodeType": {
                "enum": [
                  "CLIENT",
                  "SERVER",
                  "PROXY",
                  "WEB_SERVER",
                  "DATABASE",
                  "AD",
                  "FILE_SERVER",
                  "LOG_SERVER",
                  "MAIL_SERVER",
                  "EXTERNAL"
                ]
              },
              "os": {
                "enum": [
                  "windows",
                  "linux",
                  "macos",
                  "network",
                  "other"
                ]
              },
              "ip": {
                "type": "string",
                "minLength": 3,
                "maxLength": 80
              },
              "subnetId": {
                "type": "string",
                "minLength": 1,
                "maxLength": 80,
                "pattern": "^[a-z][a-z0-9_-]*$"
              },
              "trustBoundaryId": {
                "type": "string",
                "minLength": 1,
                "maxLength": 80,
                "pattern": "^[a-z][a-z0-9_-]*$"
              },
              "roles": {
                "type": "array",
                "items": {
                  "type": "string",
                  "minLength": 1,
                  "maxLength": 80,
                  "pattern": "^[a-z][a-z0-9_-]*$"
                },
                "minItems": 1,
                "maxItems": 16
              },
              "logSources": {
                "type": "array",
                "items": {
                  "enum": [
                    "WEB_LOG",
                    "PROXY_LOG",
                    "AUTH_LOG",
                    "APPLICATION_LOG",
                    "NETWORK_LOG",
                    "EMAIL",
                    "BROWSER_HISTORY",
                    "DEVICE",
                    "FILE",
                    "CONFIGURATION"
                  ]
                },
                "minItems": 0,
                "maxItems": 10
              }
            },
            "required": [
              "nodeId",
              "label",
              "nodeType",
              "os",
              "ip",
              "subnetId",
              "trustBoundaryId",
              "roles",
              "logSources"
            ],
            "additionalProperties": false
          },
          "minItems": 1,
          "maxItems": 128
        },
        "services": {
          "type": "array",
          "items": {
            "type": "object",
            "properties": {
              "serviceId": {
                "type": "string",
                "minLength": 1,
                "maxLength": 80,
                "pattern": "^[a-z][a-z0-9_-]*$"
              },
              "nodeId": {
                "type": "string",
                "minLength": 1,
                "maxLength": 80,
                "pattern": "^[a-z][a-z0-9_-]*$"
              },
              "label": {
                "type": "string",
                "minLength": 1,
                "maxLength": 120
              },
              "serviceType": {
                "enum": [
                  "web_browser",
                  "email",
                  "web_application",
                  "sql_database",
                  "proxy",
                  "authentication",
                  "file",
                  "logging",
                  "remote_access",
                  "local_execution"
                ]
              },
              "platform": {
                "enum": [
                  "browser",
                  "email",
                  "web",
                  "sql",
                  "proxy",
                  "auth",
                  "file",
                  "logging",
                  "ssh",
                  "linux",
                  "windows"
                ]
              }
            },
            "required": [
              "serviceId",
              "nodeId",
              "label",
              "serviceType",
              "platform"
            ],
            "additionalProperties": false
          },
          "minItems": 1,
          "maxItems": 256
        },
        "connections": {
          "type": "array",
          "items": {
            "type": "object",
            "properties": {
              "fromNodeId": {
                "type": "string",
                "minLength": 1,
                "maxLength": 80,
                "pattern": "^[a-z][a-z0-9_-]*$"
              },
              "toNodeId": {
                "type": "string",
                "minLength": 1,
                "maxLength": 80,
                "pattern": "^[a-z][a-z0-9_-]*$"
              }
            },
            "required": [
              "fromNodeId",
              "toNodeId"
            ],
            "additionalProperties": false
          },
          "minItems": 0,
          "maxItems": 1024
        }
      },
      "required": [
        "subnets",
        "nodes",
        "services",
        "connections"
      ],
      "additionalProperties": false
    }
  },
  "required": [
    "schemaVersion",
    "id",
    "label",
    "description",
    "network"
  ],
  "additionalProperties": false
}
